[
  {
    "id": "salaries-entry-all-annual-current-job-2022",
    "value": 59876000,
    "unit": "krw",
    "source_id": "kistep-2024-st-indicators",
    "table": "표 B-3-16",
    "page": 87,
    "population": "내국인(외국인 제외) 신규 박사학위 취득자 중 취업자, 전체, 현 직장 연봉(연 단위)",
    "denominator": "",
    "year": 2022,
    "checked_on": "2026-10-13",
    "confidence": "verified",
    "note": "연 단위 세전 여부는 원문에 명시 없음. 원문 단위 만원, 5,987.6만원×10,000으로 원 환산. 현 직장에서의 연봉이며 초임 그 자체가 아니라 학위 취득 시점 조사 응답. 출처 표는 KRIVET 국내신규박사학위취득자 실태조사 재분석(주: 2020년부터 전공분류가 7개 계열에서 한국표준교육분류 10개로 변경, KEDI 학과분류연계표(2019)로 기존 7개 계열 체계로 환산). 졸업자 조사이며 입학자 종단조사가 아님. 응답자 수(N)는 표에 없음. PDF 93쪽."
  },
  {
    "id": "salaries-entry-nonscitech-annual-current-job-2022",
    "value": 52472000,
    "unit": "krw",
    "source_id": "kistep-2024-st-indicators",
    "table": "표 B-3-16",
    "page": 87,
    "population": "내국인(외국인 제외) 신규 박사학위 취득자 중 취업자, 비과학기술인력(자연·공학·의약계열 외 전공), 현 직장 연봉(연 단위)",
    "denominator": "",
    "year": 2022,
    "checked_on": "2026-10-13",
    "confidence": "verified",
    "note": "연 단위 세전 여부는 원문에 명시 없음. 원문 단위 만원, 5,247.2만원×10,000으로 원 환산. 현 직장에서의 연봉이며 초임 그 자체가 아니라 학위 취득 시점 조사 응답. 출처 표는 KRIVET 국내신규박사학위취득자 실태조사 재분석(주: 2020년부터 전공분류가 7개 계열에서 한국표준교육분류 10개로 변경, KEDI 학과분류연계표(2019)로 기존 7개 계열 체계로 환산). 졸업자 조사이며 입학자 종단조사가 아님. 응답자 수(N)는 표에 없음. PDF 93쪽."
  },
  {
    "id": "salaries-entry-all-annual-current-job-2021",
    "value": 59023000,
    "unit": "krw",
    "source_id": "kistep-2024-st-indicators",
    "table": "표 B-3-16",
    "page": 87,
    "population": "내국인(외국인 제외) 신규 박사학위 취득자 중 취업자, 전체, 현 직장 연봉(연 단위)",
    "denominator": "",
    "year": 2021,
    "checked_on": "2026-10-13",
    "confidence": "verified",
    "note": "연 단위 세전 여부는 원문에 명시 없음. 원문 단위 만원, 5,902.3만원×10,000으로 원 환산. 현 직장에서의 연봉이며 초임 그 자체가 아니라 학위 취득 시점 조사 응답. 출처 표는 KRIVET 국내신규박사학위취득자 실태조사 재분석(주: 2020년부터 전공분류가 7개 계열에서 한국표준교육분류 10개로 변경, KEDI 학과분류연계표(2019)로 기존 7개 계열 체계로 환산). 졸업자 조사이며 입학자 종단조사가 아님. 응답자 수(N)는 표에 없음. PDF 93쪽."
  },
  {
    "id": "salaries-entry-scitech-annual-current-job-2021",
    "value": 63044000,
    "unit": "krw",
    "source_id": "kistep-2024-st-indicators",
    "table": "표 B-3-16",
    "page": 87,
    "population": "내국인(외국인 제외) 신규 박사학위 취득자 중 취업자, 과학기술인력(자연·공학·의약계열 전공), 현 직장 연봉(연 단위)",
    "denominator": "",
    "year": 2021,
    "checked_on": "2026-10-13",
    "confidence": "verified",
    "note": "연 단위 세전 여부는 원문에 명시 없음. 원문 단위 만원, 6,304.4만원×10,000으로 원 환산. 현 직장에서의 연봉이며 초임 그 자체가 아니라 학위 취득 시점 조사 응답. 출처 표는 KRIVET 국내신규박사학위취득자 실태조사 재분석(주: 2020년부터 전공분류가 7개 계열에서 한국표준교육분류 10개로 변경, KEDI 학과분류연계표(2019)로 기존 7개 계열 체계로 환산). 졸업자 조사이며 입학자 종단조사가 아님. 응답자 수(N)는 표에 없음. PDF 93쪽."
  },
  {
    "id": "salaries-entry-nonscitech-annual-current-job-2021",
    "value": 52760000,
    "unit": "krw",
    "source_id": "kistep-2024-st-indicators",
    "table": "표 B-3-16",
    "page": 87,
    "population": "내국인(외국인 제외) 신규 박사학위 취득자 중 취업자, 비과학기술인력(자연·공학·의약계열 외 전공), 현 직장 연봉(연 단위)",
    "denominator": "",
    "year": 2021,
    "checked_on": "2026-10-13",
    "confidence": "verified",
    "note": "연 단위 세전 여부는 원문에 명시 없음. 원문 단위 만원, 5,276.0만원×10,000으로 원 환산. 현 직장에서의 연봉이며 초임 그 자체가 아니라 학위 취득 시점 조사 응답. 출처 표는 KRIVET 국내신규박사학위취득자 실태조사 재분석(주: 2020년부터 전공분류가 7개 계열에서 한국표준교육분류 10개로 변경, KEDI 학과분류연계표(2019)로 기존 7개 계열 체계로 환산). 졸업자 조사이며 입학자 종단조사가 아님. 응답자 수(N)는 표에 없음. PDF 93쪽."
  },
  {
    "id": "salaries-entry-stem-employed-annual-total-income-2021",
    "value": 100540000,
    "unit": "krw",
    "source_id": "kistep-2024-st-indicators",
    "table": "표 C-3-22",
    "page": 149,
    "population": "이공계 박사(과학기술분야 박사 중 취업자, 자연·공학·의약계열 전공), 총 근로소득(연 단위)",
    "denominator": "",
    "year": 2021,
    "checked_on": "2026-10-13",
    "confidence": "verified",
    "note": "세전근로소득 기준. 원문 단위 만원, 10,054만원×10,000으로 원 환산. 신규 박사가 아니라 경력 포함 취업 박사 전체이므로 초임으로 읽지 말 것. 출처 조사는 과기정통부·한국과학기술기획평가원 이공계인력 육성·활용과 처우 등에 관한 실태조사(KRIVET 박사조사가 아님). 원문 주: 2016년부터 조사패널 변경으로 인해 시계열 비교가 어려움. 응답자 수는 이 표에 없음. 형제 표 C-3-7의 2021년 취업자 N은 1,272명이며 이 표의 N과 같다는 보장은 없음. PDF 155쪽."
  },
  {
    "id": "salaries-stipend-bk21-phd-min",
    "value": 1600000,
    "unit": "krw",
    "source_id": "nrf-2023-bk21-guideline-revision",
    "table": "지침 개정 전·후 주요 비교표(지침 제13조)",
    "page": 2,
    "population": "4단계 BK21 지원 대학원생 중 입학한 지 4년이 지나지 않은 박사과정생(또는 입학한 지 6년이 지나지 않은 석·박사통합과정생), 월 연구장학금 하한",
    "denominator": "",
    "year": 2023,
    "checked_on": "2026-10-13",
    "confidence": "verified",
    "note": "4단계 BK21 사업 관리 운영 지침 제13조 개정안의 개정(안) 열 값(BK21사업팀 2023-02-27 개정 안내, 현행 열은 월 130만원 이상). 하한(이상) 기준이며 상한이 아님. 대학별 실제 지급액은 이보다 높을 수 있음. 읽은 문서는 한국연구재단 개정 안내 비교표이며 확정 지침 본문은 읽지 않음. 파일은 서울대 BK21 사업단 사이트(gsesbk21.snu.ac.kr)에서 내려받음."
  },
  {
    "id": "salaries-stipend-bk21-phd-completer-min",
    "value": 1300000,
    "unit": "krw",
    "source_id": "nrf-2023-bk21-guideline-revision",
    "table": "지침 개정 전·후 주요 비교표(지침 제13조)",
    "page": 2,
    "population": "4단계 BK21 지원 대학원생 중 입학한 지 4년이 지나지 않은 박사수료생(또는 입학 6년 미만 석·박사통합과정 수료생), 월 연구장학금 하한",
    "denominator": "",
    "year": 2023,
    "checked_on": "2026-10-13",
    "confidence": "verified",
    "note": "4단계 BK21 사업 관리 운영 지침 제13조 개정안의 개정(안) 열 값(BK21사업팀 2023-02-27 개정 안내, 현행 열은 월 100만원 이상). 하한(이상) 기준이며 상한이 아님. 대학별 실제 지급액은 이보다 높을 수 있음. 읽은 문서는 한국연구재단 개정 안내 비교표이며 확정 지침 본문은 읽지 않음. 파일은 서울대 BK21 사업단 사이트(gsesbk21.snu.ac.kr)에서 내려받음."
  },
  {
    "id": "salaries-stipend-bk21-master-min",
    "value": 1000000,
    "unit": "krw",
    "source_id": "nrf-2023-bk21-guideline-revision",
    "table": "지침 개정 전·후 주요 비교표(지침 제13조)",
    "page": 2,
    "population": "4단계 BK21 지원 대학원생 중 입학한 지 2년이 지나지 않은 석사과정생·석사수료생(또는 입학 2년 미만 석·박사통합과정생), 월 연구장학금 하한",
    "denominator": "",
    "year": 2023,
    "checked_on": "2026-10-13",
    "confidence": "verified",
    "note": "4단계 BK21 사업 관리 운영 지침 제13조 개정안의 개정(안) 열 값(BK21사업팀 2023-02-27 개정 안내, 현행 열은 월 70만원 이상). 하한(이상) 기준이며 상한이 아님. 대학별 실제 지급액은 이보다 높을 수 있음. 읽은 문서는 한국연구재단 개정 안내 비교표이며 확정 지침 본문은 읽지 않음. 파일은 서울대 BK21 사업단 사이트(gsesbk21.snu.ac.kr)에서 내려받음."
  },
  {
    "id": "salaries-stipend-stem-living-phd-min",
    "value": 1100000,
    "unit": "krw",
    "source_id": "msit-2025-stem-stipend-plan",
    "table": "본문",
    "page": 1,
    "population": "이공계 연구생활장려금 지원 사업(한국형 스타이펜드) 참여대학 이공계 박사과정생, 월 최소 기준금액",
    "denominator": "",
    "year": 2025,
    "checked_on": "2026-10-13",
    "confidence": "verified",
    "note": "1차년도(2025)에 설정한 최소 기준금액. 정부가 이 금액을 직접 지급하지 않고, 산학협력단에서 지급 중인 기존 R&D 인건비 등 학생지원금과 연계해 최저지급액을 보장하는 구조(정부 부족금액 지원과 대학 재정기여금). 참여대학 이공계 대학원생에게만 적용. 정책브리핑 정책뉴스가 과학기술정보통신부 자료를 인용하며 사업 시행계획 제목을 \"20205년 시행계획\"으로 오기함. 시행계획 원문은 읽지 않음."
  },
  {
    "id": "salaries-stipend-stem-living-master-min",
    "value": 800000,
    "unit": "krw",
    "source_id": "msit-2025-stem-stipend-plan",
    "table": "본문",
    "page": 1,
    "population": "이공계 연구생활장려금 지원 사업(한국형 스타이펜드) 참여대학 이공계 석사과정생, 월 최소 기준금액",
    "denominator": "",
    "year": 2025,
    "checked_on": "2026-10-13",
    "confidence": "verified",
    "note": "1차년도(2025)에 설정한 최소 기준금액. 정부가 이 금액을 직접 지급하지 않고, 산학협력단에서 지급 중인 기존 R&D 인건비 등 학생지원금과 연계해 최저지급액을 보장하는 구조(정부 부족금액 지원과 대학 재정기여금). 참여대학 이공계 대학원생에게만 적용. 정책브리핑 정책뉴스가 과학기술정보통신부 자료를 인용하며 사업 시행계획 제목을 \"20205년 시행계획\"으로 오기함. 시행계획 원문은 읽지 않음."
  }
]