[
  {
    "id": "salaries-entry-all-annual-current-job-2022",
    "value": 59876000,
    "unit": "krw",
    "source_id": "kistep-2024-st-indicators",
    "table": "표 B-3-16",
    "page": 87,
    "population": "내국인(외국인 제외) 신규 박사학위 취득자 중 취업자, 전체, 현 직장 연봉(연 단위)",
    "denominator": "",
    "year": 2022,
    "checked_on": "2026-10-13",
    "confidence": "verified",
    "note": "연 단위 세전 여부는 원문에 명시 없음. 원문 단위 만원, 5,987.6만원×10,000으로 원 환산. 현 직장에서의 연봉이며 초임 그 자체가 아니라 학위 취득 시점 조사 응답. 출처 표는 KRIVET 국내신규박사학위취득자 실태조사 재분석(주: 2020년부터 전공분류가 7개 계열에서 한국표준교육분류 10개로 변경, KEDI 학과분류연계표(2019)로 기존 7개 계열 체계로 환산). 졸업자 조사이며 입학자 종단조사가 아님. 응답자 수(N)는 표에 없음. PDF 93쪽."
  },
  {
    "id": "salaries-entry-nonscitech-annual-current-job-2022",
    "value": 52472000,
    "unit": "krw",
    "source_id": "kistep-2024-st-indicators",
    "table": "표 B-3-16",
    "page": 87,
    "population": "내국인(외국인 제외) 신규 박사학위 취득자 중 취업자, 비과학기술인력(자연·공학·의약계열 외 전공), 현 직장 연봉(연 단위)",
    "denominator": "",
    "year": 2022,
    "checked_on": "2026-10-13",
    "confidence": "verified",
    "note": "연 단위 세전 여부는 원문에 명시 없음. 원문 단위 만원, 5,247.2만원×10,000으로 원 환산. 현 직장에서의 연봉이며 초임 그 자체가 아니라 학위 취득 시점 조사 응답. 출처 표는 KRIVET 국내신규박사학위취득자 실태조사 재분석(주: 2020년부터 전공분류가 7개 계열에서 한국표준교육분류 10개로 변경, KEDI 학과분류연계표(2019)로 기존 7개 계열 체계로 환산). 졸업자 조사이며 입학자 종단조사가 아님. 응답자 수(N)는 표에 없음. PDF 93쪽."
  },
  {
    "id": "salaries-entry-all-annual-current-job-2021",
    "value": 59023000,
    "unit": "krw",
    "source_id": "kistep-2024-st-indicators",
    "table": "표 B-3-16",
    "page": 87,
    "population": "내국인(외국인 제외) 신규 박사학위 취득자 중 취업자, 전체, 현 직장 연봉(연 단위)",
    "denominator": "",
    "year": 2021,
    "checked_on": "2026-10-13",
    "confidence": "verified",
    "note": "연 단위 세전 여부는 원문에 명시 없음. 원문 단위 만원, 5,902.3만원×10,000으로 원 환산. 현 직장에서의 연봉이며 초임 그 자체가 아니라 학위 취득 시점 조사 응답. 출처 표는 KRIVET 국내신규박사학위취득자 실태조사 재분석(주: 2020년부터 전공분류가 7개 계열에서 한국표준교육분류 10개로 변경, KEDI 학과분류연계표(2019)로 기존 7개 계열 체계로 환산). 졸업자 조사이며 입학자 종단조사가 아님. 응답자 수(N)는 표에 없음. PDF 93쪽."
  },
  {
    "id": "salaries-entry-scitech-annual-current-job-2021",
    "value": 63044000,
    "unit": "krw",
    "source_id": "kistep-2024-st-indicators",
    "table": "표 B-3-16",
    "page": 87,
    "population": "내국인(외국인 제외) 신규 박사학위 취득자 중 취업자, 과학기술인력(자연·공학·의약계열 전공), 현 직장 연봉(연 단위)",
    "denominator": "",
    "year": 2021,
    "checked_on": "2026-10-13",
    "confidence": "verified",
    "note": "연 단위 세전 여부는 원문에 명시 없음. 원문 단위 만원, 6,304.4만원×10,000으로 원 환산. 현 직장에서의 연봉이며 초임 그 자체가 아니라 학위 취득 시점 조사 응답. 출처 표는 KRIVET 국내신규박사학위취득자 실태조사 재분석(주: 2020년부터 전공분류가 7개 계열에서 한국표준교육분류 10개로 변경, KEDI 학과분류연계표(2019)로 기존 7개 계열 체계로 환산). 졸업자 조사이며 입학자 종단조사가 아님. 응답자 수(N)는 표에 없음. PDF 93쪽."
  },
  {
    "id": "salaries-entry-nonscitech-annual-current-job-2021",
    "value": 52760000,
    "unit": "krw",
    "source_id": "kistep-2024-st-indicators",
    "table": "표 B-3-16",
    "page": 87,
    "population": "내국인(외국인 제외) 신규 박사학위 취득자 중 취업자, 비과학기술인력(자연·공학·의약계열 외 전공), 현 직장 연봉(연 단위)",
    "denominator": "",
    "year": 2021,
    "checked_on": "2026-10-13",
    "confidence": "verified",
    "note": "연 단위 세전 여부는 원문에 명시 없음. 원문 단위 만원, 5,276.0만원×10,000으로 원 환산. 현 직장에서의 연봉이며 초임 그 자체가 아니라 학위 취득 시점 조사 응답. 출처 표는 KRIVET 국내신규박사학위취득자 실태조사 재분석(주: 2020년부터 전공분류가 7개 계열에서 한국표준교육분류 10개로 변경, KEDI 학과분류연계표(2019)로 기존 7개 계열 체계로 환산). 졸업자 조사이며 입학자 종단조사가 아님. 응답자 수(N)는 표에 없음. PDF 93쪽."
  },
  {
    "id": "salaries-entry-stem-employed-annual-total-income-2021",
    "value": 100540000,
    "unit": "krw",
    "source_id": "kistep-2024-st-indicators",
    "table": "표 C-3-22",
    "page": 149,
    "population": "이공계 박사(과학기술분야 박사 중 취업자, 자연·공학·의약계열 전공), 총 근로소득(연 단위)",
    "denominator": "",
    "year": 2021,
    "checked_on": "2026-10-13",
    "confidence": "verified",
    "note": "세전근로소득 기준. 원문 단위 만원, 10,054만원×10,000으로 원 환산. 신규 박사가 아니라 경력 포함 취업 박사 전체이므로 초임으로 읽지 말 것. 출처 조사는 과기정통부·한국과학기술기획평가원 이공계인력 육성·활용과 처우 등에 관한 실태조사(KRIVET 박사조사가 아님). 원문 주: 2016년부터 조사패널 변경으로 인해 시계열 비교가 어려움. 응답자 수는 이 표에 없음. 형제 표 C-3-7의 2021년 취업자 N은 1,272명이며 이 표의 N과 같다는 보장은 없음. PDF 155쪽."
  }
]