[
  {
    "id": "salaries-stipend-bk21-phd-min",
    "value": 1600000,
    "unit": "krw",
    "source_id": "nrf-2023-bk21-guideline-revision",
    "table": "지침 개정 전·후 주요 비교표(지침 제13조)",
    "page": 2,
    "population": "4단계 BK21 지원 대학원생 중 입학한 지 4년이 지나지 않은 박사과정생(또는 입학한 지 6년이 지나지 않은 석·박사통합과정생), 월 연구장학금 하한",
    "denominator": "",
    "year": 2023,
    "checked_on": "2026-10-13",
    "confidence": "verified",
    "note": "4단계 BK21 사업 관리 운영 지침 제13조 개정안의 개정(안) 열 값(BK21사업팀 2023-02-27 개정 안내, 현행 열은 월 130만원 이상). 하한(이상) 기준이며 상한이 아님. 대학별 실제 지급액은 이보다 높을 수 있음. 읽은 문서는 한국연구재단 개정 안내 비교표이며 확정 지침 본문은 읽지 않음. 파일은 서울대 BK21 사업단 사이트(gsesbk21.snu.ac.kr)에서 내려받음."
  },
  {
    "id": "salaries-stipend-bk21-phd-completer-min",
    "value": 1300000,
    "unit": "krw",
    "source_id": "nrf-2023-bk21-guideline-revision",
    "table": "지침 개정 전·후 주요 비교표(지침 제13조)",
    "page": 2,
    "population": "4단계 BK21 지원 대학원생 중 입학한 지 4년이 지나지 않은 박사수료생(또는 입학 6년 미만 석·박사통합과정 수료생), 월 연구장학금 하한",
    "denominator": "",
    "year": 2023,
    "checked_on": "2026-10-13",
    "confidence": "verified",
    "note": "4단계 BK21 사업 관리 운영 지침 제13조 개정안의 개정(안) 열 값(BK21사업팀 2023-02-27 개정 안내, 현행 열은 월 100만원 이상). 하한(이상) 기준이며 상한이 아님. 대학별 실제 지급액은 이보다 높을 수 있음. 읽은 문서는 한국연구재단 개정 안내 비교표이며 확정 지침 본문은 읽지 않음. 파일은 서울대 BK21 사업단 사이트(gsesbk21.snu.ac.kr)에서 내려받음."
  },
  {
    "id": "salaries-stipend-bk21-master-min",
    "value": 1000000,
    "unit": "krw",
    "source_id": "nrf-2023-bk21-guideline-revision",
    "table": "지침 개정 전·후 주요 비교표(지침 제13조)",
    "page": 2,
    "population": "4단계 BK21 지원 대학원생 중 입학한 지 2년이 지나지 않은 석사과정생·석사수료생(또는 입학 2년 미만 석·박사통합과정생), 월 연구장학금 하한",
    "denominator": "",
    "year": 2023,
    "checked_on": "2026-10-13",
    "confidence": "verified",
    "note": "4단계 BK21 사업 관리 운영 지침 제13조 개정안의 개정(안) 열 값(BK21사업팀 2023-02-27 개정 안내, 현행 열은 월 70만원 이상). 하한(이상) 기준이며 상한이 아님. 대학별 실제 지급액은 이보다 높을 수 있음. 읽은 문서는 한국연구재단 개정 안내 비교표이며 확정 지침 본문은 읽지 않음. 파일은 서울대 BK21 사업단 사이트(gsesbk21.snu.ac.kr)에서 내려받음."
  },
  {
    "id": "salaries-stipend-stem-living-phd-min",
    "value": 1100000,
    "unit": "krw",
    "source_id": "msit-2025-stem-stipend-plan",
    "table": "본문",
    "page": 1,
    "population": "이공계 연구생활장려금 지원 사업(한국형 스타이펜드) 참여대학 이공계 박사과정생, 월 최소 기준금액",
    "denominator": "",
    "year": 2025,
    "checked_on": "2026-10-13",
    "confidence": "verified",
    "note": "1차년도(2025)에 설정한 최소 기준금액. 정부가 이 금액을 직접 지급하지 않고, 산학협력단에서 지급 중인 기존 R&D 인건비 등 학생지원금과 연계해 최저지급액을 보장하는 구조(정부 부족금액 지원과 대학 재정기여금). 참여대학 이공계 대학원생에게만 적용. 정책브리핑 정책뉴스가 과학기술정보통신부 자료를 인용하며 사업 시행계획 제목을 \"20205년 시행계획\"으로 오기함. 시행계획 원문은 읽지 않음."
  },
  {
    "id": "salaries-stipend-stem-living-master-min",
    "value": 800000,
    "unit": "krw",
    "source_id": "msit-2025-stem-stipend-plan",
    "table": "본문",
    "page": 1,
    "population": "이공계 연구생활장려금 지원 사업(한국형 스타이펜드) 참여대학 이공계 석사과정생, 월 최소 기준금액",
    "denominator": "",
    "year": 2025,
    "checked_on": "2026-10-13",
    "confidence": "verified",
    "note": "1차년도(2025)에 설정한 최소 기준금액. 정부가 이 금액을 직접 지급하지 않고, 산학협력단에서 지급 중인 기존 R&D 인건비 등 학생지원금과 연계해 최저지급액을 보장하는 구조(정부 부족금액 지원과 대학 재정기여금). 참여대학 이공계 대학원생에게만 적용. 정책브리핑 정책뉴스가 과학기술정보통신부 자료를 인용하며 사업 시행계획 제목을 \"20205년 시행계획\"으로 오기함. 시행계획 원문은 읽지 않음."
  }
]